{
  "id": "spotlight-kitbash-team",
  "version": 1,
  "title": "KitBash - Team File",
  "subtitle": "Modular Comic Book Superheroes",
  "spotlight": "KitBash",
  "variant": "Team Roster File",
  "pages": 1,
  "genre": "Comic Book / Superhero",
  "description": "Headquarters, team resources, and hero roster for superhero alliances in KitBash. Features Team Base details and 20 shared Team Resource boxes.",
  "character": {
    "id": "template-spotlight-kitbash-team",
    "isTemplate": true,
    "name": "",
    "game": "KitBash",
    "description": "",
    "pronouns": "",
    "plotPoints": 1,
    "notes": "",
    "player": "",
    "portrait": {
      "url": "",
      "view": {
        "size": "spotlight",
        "location": "header"
      }
    },
    "view": {
      "pageCount": 1,
      "spotlight": "KitBash",
      "style": {
        "hasAttributes": false
      },
      "sheetStyle": "spotlight",
      "watermark": {
        "enabled": true,
        "url": "images/cortex_prime_logo_light_transparent.png",
        "opacity": 0.08,
        "scale": 70,
        "page": "all"
      },
      "columnAlignment": "top-base",
      "columnOffsets": {
        "left": 0,
        "center": 0,
        "right": 0
      }
    },
    "sets": {
      "Team Base": {
        "id": "team-base",
        "description": "As a group, decide on the following information.",
        "nounSingular": "Detail",
        "nounPlural": "Details",
        "tags": [],
        "view": {
          "header": "top",
          "headerAlign": "left",
          "features": {
            "description": true,
            "sfx": false,
            "subtraits": false
          },
          "location": "left",
          "page": 1,
          "style": {
            "header": "labeled-fields",
            "body": "labeled-fields"
          },
          "span": 3
        },
        "traits": {
          "Name": {
            "description": "",
            "tags": [],
            "custom": {}
          },
          "Location": {
            "description": "",
            "tags": [],
            "custom": {}
          },
          "Description": {
            "description": "",
            "tags": [],
            "custom": {}
          },
          "Benefits": {
            "description": "",
            "tags": [],
            "custom": {}
          },
          "Drawbacks": {
            "description": "",
            "tags": [],
            "custom": {}
          }
        }
      },
      "Team Resources": {
        "id": "team-resources",
        "description": "Resources come from backgrounds (page 8) and are available for any PC to use.",
        "nounSingular": "Resource",
        "nounPlural": "Resources",
        "tags": [],
        "view": {
          "header": "top",
          "headerAlign": "left",
          "traitColumns": 2,
          "features": {
            "description": true,
            "sfx": false,
            "subtraits": false
          },
          "location": "left",
          "page": 1,
          "style": {
            "header": "default",
            "body": "default"
          },
          "reservedSlots": 20,
          "span": 3
        },
        "traits": {},
        "slots": {
          "0": {
            "description": "",
            "tags": [],
            "custom": {}
          },
          "1": {
            "description": "",
            "tags": [],
            "custom": {}
          },
          "2": {
            "description": "",
            "tags": [],
            "custom": {}
          },
          "3": {
            "description": "",
            "tags": [],
            "custom": {}
          },
          "4": {
            "description": "",
            "tags": [],
            "custom": {}
          },
          "5": {
            "description": "",
            "tags": [],
            "custom": {}
          },
          "6": {
            "description": "",
            "tags": [],
            "custom": {}
          },
          "7": {
            "description": "",
            "tags": [],
            "custom": {}
          },
          "8": {
            "description": "",
            "tags": [],
            "custom": {}
          },
          "9": {
            "description": "",
            "tags": [],
            "custom": {}
          },
          "10": {
            "description": "",
            "tags": [],
            "custom": {}
          },
          "11": {
            "description": "",
            "tags": [],
            "custom": {}
          },
          "12": {
            "description": "",
            "tags": [],
            "custom": {}
          },
          "13": {
            "description": "",
            "tags": [],
            "custom": {}
          },
          "14": {
            "description": "",
            "tags": [],
            "custom": {}
          },
          "15": {
            "description": "",
            "tags": [],
            "custom": {}
          },
          "16": {
            "description": "",
            "tags": [],
            "custom": {}
          },
          "17": {
            "description": "",
            "tags": [],
            "custom": {}
          },
          "18": {
            "description": "",
            "tags": [],
            "custom": {}
          },
          "19": {
            "description": "",
            "tags": [],
            "custom": {}
          }
        }
      }
    }
  }
}
