{
  "id": "spotlight-solarpunk-commune",
  "version": 1,
  "title": "SolarPunk - Commune File",
  "subtitle": "Ecological Hope & Community Technology",
  "spotlight": "SolarPunk",
  "variant": "Commune File",
  "pages": 1,
  "genre": "SolarPunk / Settlement",
  "description": "Bioregional commune worksheet for SolarPunk settings. Tracks Commune Attributes (Resources, Security, Connections — d4 to d8), Commune Distinctions (Unity, Organization, Morale), 4 d6 Signature Assets, and 9 Commune Skills (d6-d8).",
  "character": {
    "id": "template-spotlight-solarpunk-commune",
    "isTemplate": true,
    "name": "",
    "game": "SolarPunk",
    "description": "",
    "pronouns": "",
    "plotPoints": 1,
    "notes": "",
    "custom": {
      "cortexToolkit": {
        "pageCount": 1,
        "spotlight": "SolarPunk",
        "style": {
          "hasAttributes": false
        },
        "sheetStyle": "spotlight",
        "columns": 2,
        "watermark": {
          "enabled": true,
          "url": "images/cortex_prime_logo_light_transparent.png",
          "opacity": 0.08,
          "scale": 70,
          "page": "all"
        },
        "columnAlignment": "top-base",
        "columnOffsets": {
          "left": 0,
          "center": 0,
          "right": 0
        }
      }
    },
    "player": "",
    "portrait": {
      "url": "",
      "custom": {
        "cortexToolkit": {
          "size": "spotlight",
          "location": "header"
        }
      }
    },
    "sets": {
      "Attributes": {
        "id": "commune-attributes",
        "description": "Collective settlement strengths",
        "nounSingular": "Attribute",
        "nounPlural": "Attributes",
        "ratingPosition": "below",
        "tags": [],
        "custom": {
          "cortexToolkit": {
            "features": {
              "description": false,
              "sfx": false,
              "subtraits": false
            },
            "location": "left",
            "page": 1,
            "style": {
              "header": "default",
              "body": "default"
            },
            "ratingPosition": "below",
            "ratingScale": [
              4,
              6,
              8
            ],
            "multiDie": false,
            "stressConfig": {
              "includeOut": true
            },
            "notes": "",
            "reservedSlots": 3,
            "attributesRing": false,
            "colWidth": 28
          }
        },
        "traits": {
          "Resources": {
            "description": "",
            "tags": [],
            "custom": {}
          },
          "Security": {
            "description": "",
            "tags": [],
            "custom": {}
          },
          "Connections": {
            "description": "",
            "tags": [],
            "custom": {}
          }
        }
      },
      "Distinctions": {
        "id": "commune-distinctions",
        "description": "Settlement unity, organization, and morale",
        "nounSingular": "Distinction",
        "nounPlural": "Distinctions",
        "tags": [],
        "custom": {
          "cortexToolkit": {
            "features": {
              "description": true,
              "sfx": false,
              "subtraits": false
            },
            "sharedHinder": true,
            "sharedHinderText": "Gain a PP when you trade out your distinction's d8 rating for a d4.",
            "ratingScale": [
              8
            ],
            "location": "right",
            "page": 1,
            "style": {
              "header": "distinctions",
              "body": "distinctions"
            },
            "multiDie": false,
            "stressConfig": {
              "includeOut": true
            },
            "notes": "",
            "reservedSlots": 3
          }
        },
        "traits": {
          "Unity:": {
            "value": "d8",
            "description": "",
            "tags": [],
            "custom": {},
            "traits": {
              "SFX": {
                "traits": {
                  "Hinder": {}
                }
              }
            }
          },
          "Organization:": {
            "value": "d8",
            "description": "",
            "tags": [],
            "custom": {},
            "traits": {
              "SFX": {
                "traits": {
                  "Hinder": {}
                }
              }
            }
          },
          "Morale:": {
            "value": "d8",
            "description": "",
            "tags": [],
            "custom": {},
            "traits": {
              "SFX": {
                "traits": {
                  "Hinder": {}
                }
              }
            }
          }
        }
      },
      "Signature Assets": {
        "id": "signature-assets",
        "description": "",
        "nounSingular": "Asset",
        "nounPlural": "Assets",
        "ratingPosition": "inline",
        "tags": [],
        "custom": {
          "cortexToolkit": {
            "header": "top",
            "headerAlign": "center",
            "traitColumns": 2,
            "features": {
              "description": true,
              "sfx": false,
              "subtraits": false
            },
            "location": "left",
            "page": 1,
            "style": {
              "header": "default",
              "body": "default"
            },
            "ratingScale": [
              6
            ],
            "reservedSlots": 4,
            "colSpan": "full",
            "columnSpan": "full"
          }
        },
        "traits": {},
        "slots": {
          "0": {
            "value": "d6",
            "description": "",
            "tags": [],
            "custom": {}
          },
          "1": {
            "value": "d6",
            "description": "",
            "tags": [],
            "custom": {}
          },
          "2": {
            "value": "d6",
            "description": "",
            "tags": [],
            "custom": {}
          },
          "3": {
            "value": "d6",
            "description": "",
            "tags": [],
            "custom": {}
          }
        }
      },
      "Skills": {
        "id": "skills",
        "description": "",
        "nounSingular": "Skill",
        "nounPlural": "Skills",
        "tags": [],
        "custom": {
          "cortexToolkit": {
            "header": "top",
            "headerAlign": "left",
            "features": {
              "description": false,
              "sfx": false,
              "subtraits": true
            },
            "location": "left",
            "page": 1,
            "style": {
              "header": "default",
              "body": "subtrait-columns"
            },
            "ratingScale": [
              6,
              8
            ],
            "subtraitRatingScale": [],
            "reservedSlots": 9,
            "colSpan": "full",
            "columnSpan": "full"
          }
        },
        "traits": {},
        "slots": {
          "0": {
            "description": "",
            "tags": [],
            "custom": {},
            "slots": {
              "0": {
                "description": "",
                "tags": [],
                "custom": {}
              }
            }
          },
          "1": {
            "description": "",
            "tags": [],
            "custom": {},
            "slots": {
              "0": {
                "description": "",
                "tags": [],
                "custom": {}
              }
            }
          },
          "2": {
            "description": "",
            "tags": [],
            "custom": {},
            "slots": {
              "0": {
                "description": "",
                "tags": [],
                "custom": {}
              }
            }
          },
          "3": {
            "description": "",
            "tags": [],
            "custom": {},
            "slots": {
              "0": {
                "description": "",
                "tags": [],
                "custom": {}
              }
            }
          },
          "4": {
            "description": "",
            "tags": [],
            "custom": {},
            "slots": {
              "0": {
                "description": "",
                "tags": [],
                "custom": {}
              }
            }
          },
          "5": {
            "description": "",
            "tags": [],
            "custom": {},
            "slots": {
              "0": {
                "description": "",
                "tags": [],
                "custom": {}
              }
            }
          },
          "6": {
            "description": "",
            "tags": [],
            "custom": {},
            "slots": {
              "0": {
                "description": "",
                "tags": [],
                "custom": {}
              }
            }
          },
          "7": {
            "description": "",
            "tags": [],
            "custom": {},
            "slots": {
              "0": {
                "description": "",
                "tags": [],
                "custom": {}
              }
            }
          },
          "8": {
            "description": "",
            "tags": [],
            "custom": {},
            "slots": {
              "0": {
                "description": "",
                "tags": [],
                "custom": {}
              }
            }
          }
        }
      }
    }
  }
}
