{
  "id": "spotlight-hammerheads-vehicle",
  "version": 1,
  "title": "Hammerheads - Vehicle File",
  "subtitle": "Rescue Craft & Fleet Support",
  "spotlight": "Hammerheads",
  "variant": "Vehicle File",
  "pages": 1,
  "genre": "Action / Rescue / Vehicles",
  "description": "The three Hammerhead rescue craft and their fleet support web. Features Hammerhead Attributes (Systems/Engines/Frame for Hammerheads One, Two, and Three with fixed starting ratings), three Vehicle Distinctions with shared Hinder, and six multi-die Resource Pools (Unassigned, Tactical, Medical, IT/Network, Food/Shelter, Land/Sea/Air).",
  "character": {
    "id": "template-spotlight-hammerheads-vehicle",
    "isTemplate": true,
    "name": "",
    "game": "Hammerheads",
    "description": "",
    "pronouns": "",
    "plotPoints": 1,
    "notes": "",
    "player": "",
    "portrait": {
      "url": "",
      "view": {
        "size": "spotlight",
        "location": "header"
      }
    },
    "view": {
      "pageCount": 1,
      "spotlight": "Hammerheads",
      "style": {
        "hasAttributes": false
      },
      "sheetStyle": "spotlight",
      "columnAlignment": "top-base",
      "columnOffsets": {
        "left": 0,
        "center": 0,
        "right": 0
      }
    },
    "sets": {
      "Hammerhead Attributes": {
        "id": "hammerhead-attributes",
        "description": "Rescue craft airframes, systems, and handling",
        "nounSingular": "Hammerhead Attribute",
        "nounPlural": "Hammerhead Attributes",
        "tags": [],
        "view": {
          "features": {
            "description": true,
            "sfx": false,
            "subtraits": true
          },
          "page": 1,
          "style": {
            "header": "default",
            "body": "default"
          },
          "ratingScale": [
            8,
            10
          ],
          "subtraitRatingScale": [
            8,
            10
          ],
          "multiDie": false,
          "notes": "",
          "reservedSlots": 3,
          "place": {
            "left": "0%",
            "top": 0,
            "width": "25%",
            "height": 1
          }
        },
        "traits": {
          "Hammerhead One": {
            "description": "More agile, possesses more precise sensors and instruments.",
            "tags": [],
            "custom": {},
            "traits": {
              "Systems": {
                "value": "d10",
                "description": "",
                "tags": [],
                "custom": {}
              },
              "Engines": {
                "value": "d8",
                "description": "",
                "tags": [],
                "custom": {}
              },
              "Frame": {
                "value": "d8",
                "description": "",
                "tags": [],
                "custom": {}
              }
            }
          },
          "Hammerhead Two": {
            "description": "Faster, more power and range.",
            "tags": [],
            "custom": {},
            "traits": {
              "Systems": {
                "value": "d8",
                "description": "",
                "tags": [],
                "custom": {}
              },
              "Engines": {
                "value": "d10",
                "description": "",
                "tags": [],
                "custom": {}
              },
              "Frame": {
                "value": "d8",
                "description": "",
                "tags": [],
                "custom": {}
              }
            }
          },
          "Hammerhead Three": {
            "description": "Bigger, tougher, and more rugged.",
            "tags": [],
            "custom": {},
            "traits": {
              "Systems": {
                "value": "d8",
                "description": "",
                "tags": [],
                "custom": {}
              },
              "Engines": {
                "value": "d8",
                "description": "",
                "tags": [],
                "custom": {}
              },
              "Frame": {
                "value": "d10",
                "description": "",
                "tags": [],
                "custom": {}
              }
            }
          }
        }
      },
      "Vehicle Distinctions": {
        "id": "vehicle-distinctions",
        "description": "Factory blessings and fleet reputation",
        "nounSingular": "Vehicle Distinction",
        "nounPlural": "Vehicle Distinctions",
        "tags": [],
        "view": {
          "features": {
            "description": false,
            "sfx": false,
            "subtraits": false
          },
          "page": 1,
          "style": {
            "header": "distinctions",
            "body": "distinctions"
          },
          "ratingScale": [
            8
          ],
          "multiDie": false,
          "notes": "",
          "reservedSlots": 3,
          "sharedHinder": true,
          "sharedHinderText": "Gain a PP when you switch out your distinction's rating of d8 for a d4.",
          "place": {
            "left": "25%",
            "top": 0,
            "width": "50%",
            "height": 1
          }
        },
        "traits": {
          "Resource Support Vehicle": {
            "value": "d8",
            "description": "",
            "tags": [],
            "custom": {}
          },
          "Top of the Line": {
            "value": "d8",
            "description": "",
            "tags": [],
            "custom": {}
          },
          "Broad-Spectrum Sensors": {
            "value": "d8",
            "description": "",
            "tags": [],
            "custom": {}
          }
        }
      },
      "Resource Pools": {
        "id": "resource-pools",
        "description": "Staged supplies, support teams, and fleet backup",
        "nounSingular": "Resource Pool",
        "nounPlural": "Resource Pools",
        "tags": [],
        "view": {
          "traitColumns": 2,
          "features": {
            "description": false,
            "sfx": false,
            "subtraits": false
          },
          "page": 1,
          "style": {
            "header": "default",
            "body": "dice-count"
          },
          "ratingScale": [
            6
          ],
          "multiDie": true,
          "notes": "",
          "reservedSlots": 6,
          "place": {
            "left": "75%",
            "top": 0,
            "width": "25%",
            "height": 1
          }
        },
        "traits": {
          "Unassigned Resources": {
            "value": "7d6",
            "pool": true,
            "description": "",
            "tags": [],
            "custom": {}
          },
          "Tactical Support": {
            "value": "4d6",
            "pool": true,
            "description": "",
            "tags": [],
            "custom": {}
          },
          "Medical Supplies": {
            "value": "4d6",
            "pool": true,
            "description": "",
            "tags": [],
            "custom": {}
          },
          "IT/Network Support": {
            "value": "4d6",
            "pool": true,
            "description": "",
            "tags": [],
            "custom": {}
          },
          "Food/Shelter": {
            "value": "4d6",
            "pool": true,
            "description": "",
            "tags": [],
            "custom": {}
          },
          "Land/Sea/Air Support": {
            "value": "4d6",
            "pool": true,
            "description": "",
            "tags": [],
            "custom": {}
          }
        }
      }
    }
  }
}
